{
  "id": "claim.nulumin.domestic-shipping",
  "claim": "Ships within the United States.",
  "brand": "brand.nulumin",
  "source": {
    "url": "https://nulumin.org",
    "title": "nulumin.org — shipping destinations",
    "retrievedAt": "2026-07-24",
    "support": "Published domestic shipping scope."
  },
  "status": "draft",
  "reviewedAt": "2026-07-24",
  "reviewAfter": "2027-01-24",
  "jurisdictions": [
    "US"
  ],
  "platforms": [
    "owned-web",
    "email",
    "meta",
    "tiktok"
  ],
  "approvedUses": [
    "static ad",
    "carousel",
    "email"
  ],
  "prohibitedUses": [
    "Never pair with human-use, dosing, reconstitution, or administration content."
  ],
  "owner": "unassigned",
  "notes": "status=draft. The source below was verified on the live site; that is evidence the statement is PUBLISHED, not that it is legally approved for advertising. A qualified human owner must verify the substantiation, set `owner`, refresh `reviewedAt`, and flip `status` to \"approved\" before any job may cite this record."
}
