{
  "id": "claim.nulumin.free-shipping-200",
  "claim": "Free shipping on U.S. orders over $200, applied at checkout.",
  "brand": "brand.nulumin",
  "source": {
    "url": "https://nulumin.org",
    "title": "nulumin.org — shipping threshold",
    "retrievedAt": "2026-07-24",
    "support": "Published free-shipping threshold."
  },
  "status": "draft",
  "reviewedAt": "2026-07-24",
  "reviewAfter": "2027-01-24",
  "jurisdictions": [
    "US"
  ],
  "platforms": [
    "owned-web",
    "email",
    "meta",
    "tiktok"
  ],
  "approvedUses": [
    "static ad",
    "email"
  ],
  "prohibitedUses": [
    "Never pair with human-use, dosing, reconstitution, or administration content.",
    "Offers are commerce signals — omit on organic social for this category."
  ],
  "owner": "unassigned",
  "notes": "status=draft. The source below was verified on the live site; that is evidence the statement is PUBLISHED, not that it is legally approved for advertising. A qualified human owner must verify the substantiation, set `owner`, refresh `reviewedAt`, and flip `status` to \"approved\" before any job may cite this record."
}
